{
  "$schema": "https://json-schema.org/draft/2020-12/schema",
  "$id": "https://8978.ai/schemas/development-authority-migration-execution-packet.schema.json",
  "type": "object",
  "additionalProperties": false,
  "required": ["schemaVersion","status","governing","environment","phase","executionAuthorized","foundationBaseline","sourcePlan","sourceCompletionRecord","account","authorityDatabase","migrationConfiguration","backup","migration","commands","postMigrationBoundary","stopConditions","prohibitedOperations","partialFailurePolicy","requiredEvidence"],
  "properties": {
    "schemaVersion":{"const":"1.0.0"},"status":{"const":"PLANNED"},"governing":{"const":false},"environment":{"const":"development"},
    "phase":{"const":"capture_backup_and_apply_authority_migrations"},"executionAuthorized":{"const":false},"foundationBaseline":{"const":"ebd7a82dc47095814de2dc663c5615d60e87b0e1"},
    "sourcePlan":{"type":"object","additionalProperties":false,"required":["path","sha256"],"properties":{"path":{"const":"deployment/development-activation-plan-resource-reconciled.json"},"sha256":{"const":"3621dc92abf5c309d4a92a86cf4dc3f01da473d88c273697c9e91e9e7d092825"}}},
    "sourceCompletionRecord":{"type":"object","additionalProperties":false,"required":["path","sha256"],"properties":{"path":{"const":"deployment/development-resource-creation-completion-record.json"},"sha256":{"const":"98f9c0623e2240aad87d68f9fdc7b3fe895d0853308d272c9398ec6858815747"}}},
    "account":{"type":"object","additionalProperties":false,"required":["accountId","selection"],"properties":{"accountId":{"type":"null"},"selection":{"const":"exact_owner_authorized_account_required_at_execution"}}},
    "authorityDatabase":{"type":"object","additionalProperties":false,"required":["name","databaseId","expectedRegion","expectedJurisdiction","requiredVersion","requiredPreMigrationTableCount"],"properties":{"name":{"const":"8978-ai-authority-dev"},"databaseId":{"const":"741ade94-8539-4fc8-b6be-24884720dee8"},"expectedRegion":{"const":"WNAM"},"expectedJurisdiction":{"type":"null"},"requiredVersion":{"const":"production"},"requiredPreMigrationTableCount":{"const":0}}},
    "migrationConfiguration":{"type":"object","additionalProperties":false,"required":["path","sha256","deployableWorkerConfiguration","installsRuntimeBinding","migrationsDirectory"],"properties":{"path":{"const":"deployment/wrangler.authority-migrations.jsonc"},"sha256":{"const":"7d028839586d0009ff88ec172da85efaa0bb1e05b43644af65f37dd1cd7fbd26"},"deployableWorkerConfiguration":{"const":false},"installsRuntimeBinding":{"const":false},"migrationsDirectory":{"const":"../migrations/authority"}}},
    "backup":{"type":"object","additionalProperties":false,"required":["timeTravelBookmarkRequired","sqlExportRequired","exportStorage","exportSha256Required","commitExportToRepository","restoreAuthorized","automaticRestoreAuthorized"],"properties":{"timeTravelBookmarkRequired":{"const":true},"sqlExportRequired":{"const":true},"exportStorage":{"const":"ephemeral_untracked_local_file"},"exportSha256Required":{"const":true},"commitExportToRepository":{"const":false},"restoreAuthorized":{"const":false},"automaticRestoreAuthorized":{"const":false}}},
    "migration":{"type":"object","additionalProperties":false,"required":["operation","attemptLimit","remote","createsMigrationBookkeepingRows","insertsAuthorityData","seedsProjectKnowledge","writesActivationEvidence","migrations"],"properties":{"operation":{"const":"apply_exact_pending_migrations_once"},"attemptLimit":{"const":1},"remote":{"const":true},"createsMigrationBookkeepingRows":{"const":true},"insertsAuthorityData":{"const":false},"seedsProjectKnowledge":{"const":false},"writesActivationEvidence":{"const":false},"migrations":{"type":"array","minItems":6,"maxItems":6,"items":{"type":"object","additionalProperties":false,"required":["path","sha256"],"properties":{"path":{"type":"string","minLength":1},"sha256":{"type":"string","pattern":"^[a-f0-9]{64}$"}}}}}},
    "commands":{"type":"object","additionalProperties":false,"required":["databaseInfo","timeTravelBookmark","sqlExportTemplate","listPending","applyOnce","listPendingAfter"],"properties":{"databaseInfo":{"const":"wrangler d1 info 8978-ai-authority-dev --json"},"timeTravelBookmark":{"const":"wrangler d1 time-travel info 8978-ai-authority-dev --json"},"sqlExportTemplate":{"const":"wrangler d1 export 8978-ai-authority-dev --remote --output <ephemeral-untracked-path>"},"listPending":{"const":"wrangler d1 migrations list 8978-ai-authority-dev --remote --config deployment/wrangler.authority-migrations.jsonc"},"applyOnce":{"const":"wrangler d1 migrations apply 8978-ai-authority-dev --remote --config deployment/wrangler.authority-migrations.jsonc"},"listPendingAfter":{"const":"wrangler d1 migrations list 8978-ai-authority-dev --remote --config deployment/wrangler.authority-migrations.jsonc"}}},
    "postMigrationBoundary":{"type":"object","additionalProperties":false,"required":["requireNoPendingMigrations","expectedTableCountIncludingMigrationBookkeeping","remoteSchemaVerified","activationPlanUpdateDeferred","executionRecordRequired"],"properties":{"requireNoPendingMigrations":{"const":true},"expectedTableCountIncludingMigrationBookkeeping":{"const":11},"remoteSchemaVerified":{"const":false},"activationPlanUpdateDeferred":{"const":true},"executionRecordRequired":{"const":true}}},
    "stopConditions":{"type":"array","minItems":10,"maxItems":10,"items":{"type":"string","minLength":1}},
    "prohibitedOperations":{"type":"array","minItems":17,"maxItems":17,"items":{"type":"string","minLength":1}},
    "partialFailurePolicy":{"type":"object","additionalProperties":false,"required":["automaticRestore","automaticRetry","automaticCleanup","action"],"properties":{"automaticRestore":{"const":false},"automaticRetry":{"const":false},"automaticCleanup":{"const":false},"action":{"const":"stop_and_report_exact_remote_state"}}},
    "requiredEvidence":{"type":"array","minItems":12,"maxItems":12,"items":{"type":"string","minLength":1}}
  }
}
